[
    {
        "id": "MOD_WOUNDED",
        "label": "Ferido",
        "category": "FERIDA_SOMBRA_FRATURA",
        "description": "Arquétipo que carrega dor ativa, trauma ou dano recente. Age a partir de feridas não integradas.",
        "tw_alignment": [
            "6"
        ]
    },
    {
        "id": "MOD_REBORN",
        "label": "Renascente",
        "category": "EXPANSAO_ASCENSAO_IMPULSO",
        "description": "Arquétipo que passou por colapso ou morte simbólica e está voltando à vida em uma nova forma.",
        "tw_alignment": [
            "3",
            "9"
        ]
    },
    {
        "id": "MOD_SHADOW",
        "label": "Sombrio",
        "category": "FERIDA_SOMBRA_FRATURA",
        "description": "Arquétipo que opera pela sombra: manipulação, repressão, distorção ou negação de sua função original.",
        "tw_alignment": [
            "6",
            "9"
        ]
    },
    {
        "id": "MOD_COLLECTIVE",
        "label": "Coletivo",
        "category": "COLETIVO_SISTEMICO_ORGANICO",
        "description": "Arquétipo que deixou de ser apenas individual e passou a operar como campo coletivo, grupo ou instituição.",
        "tw_alignment": [
            "9"
        ]
    },
    {
        "id": "MOD_FRAGMENTED",
        "label": "Fragmentado",
        "category": "FERIDA_SOMBRA_FRATURA",
        "description": "Arquétipo dividido em partes desconectadas: discurso, emoção e ação não se alinham entre si.",
        "tw_alignment": [
            "6"
        ]
    },
    {
        "id": "MOD_CYNICAL",
        "label": "Cínico",
        "category": "MENTAL_PSICOLOGICO_CINICO",
        "description": "Arquétipo que perdeu a inocência e a fé; lê o mundo com ironia, suspeita e descrença.",
        "tw_alignment": [
            "3",
            "6"
        ]
    },
    {
        "id": "MOD_EUPHORIC",
        "label": "Eufórico",
        "category": "EXPANSAO_ASCENSAO_IMPULSO",
        "description": "Arquétipo em estado de excitação e otimismo extremo, com tendência a subestimar riscos.",
        "tw_alignment": [
            "3",
            "6"
        ]
    },
    {
        "id": "MOD_ASCENDANT",
        "label": "Ascendente",
        "category": "EXPANSAO_ASCENSAO_IMPULSO",
        "description": "Arquétipo em curva de alta: ganhando poder, influência e espaço simbólico.",
        "tw_alignment": [
            "3",
            "9"
        ]
    },
    {
        "id": "MOD_DESCENDANT",
        "label": "Descendente",
        "category": "CONTRACAO_QUEDA_DEFESA",
        "description": "Arquétipo em curva de queda: perdendo relevância, autoridade ou energia.",
        "tw_alignment": [
            "6",
            "9"
        ]
    },
    {
        "id": "MOD_VOLATILE",
        "label": "Volátil",
        "category": "CONTRACAO_QUEDA_DEFESA",
        "description": "Arquétipo instável, com mudanças bruscas de humor, direção ou narrativa.",
        "tw_alignment": [
            "6"
        ]
    },
    {
        "id": "MOD_HAUNTED",
        "label": "Assombrado",
        "category": "FERIDA_SOMBRA_FRATURA",
        "description": "Arquétipo preso a memórias, erros ou traumas passados que continuam influenciando o presente.",
        "tw_alignment": [
            "6",
            "9"
        ]
    },
    {
        "id": "MOD_BURNED_OUT",
        "label": "Exaurido",
        "category": "FERIDA_SOMBRA_FRATURA",
        "description": "Arquétipo que perdeu energia vital; continua funcionando por inércia ou obrigação.",
        "tw_alignment": [
            "6",
            "9"
        ]
    },
    {
        "id": "MOD_PARANOID",
        "label": "Paranoico",
        "category": "FERIDA_SOMBRA_FRATURA",
        "description": "Arquétipo dominado por vigilância extrema, medo de ameaça e fantasia de perseguição.",
        "tw_alignment": [
            "6"
        ]
    },
    {
        "id": "MOD_COLLAPSING",
        "label": "Colapsante",
        "category": "FERIDA_SOMBRA_FRATURA",
        "description": "Arquétipo em processo de desintegração; a estrutura simbólica já começou a ruir.",
        "tw_alignment": [
            "6",
            "9"
        ]
    },
    {
        "id": "MOD_SUPPRESSED",
        "label": "Suprimido",
        "category": "FERIDA_SOMBRA_FRATURA",
        "description": "Arquétipo que tenta emergir, mas é abafado por forças internas ou externas.",
        "tw_alignment": [
            "6"
        ]
    },
    {
        "id": "MOD_HIDDEN",
        "label": "Oculto",
        "category": "FERIDA_SOMBRA_FRATURA",
        "description": "Arquétipo ativo nos bastidores, mas não reconhecido explicitamente na narrativa.",
        "tw_alignment": [
            "6",
            "9"
        ]
    },
    {
        "id": "MOD_RADIANT",
        "label": "Radiante",
        "category": "EXPANSAO_ASCENSAO_IMPULSO",
        "description": "Arquétipo que irradia carisma, confiança e magnetismo; contagia o ambiente.",
        "tw_alignment": [
            "3",
            "6"
        ]
    },
    {
        "id": "MOD_EMERGENT",
        "label": "Emergente",
        "category": "EXPANSAO_ASCENSAO_IMPULSO",
        "description": "Arquétipo que está nascendo ou ganhando forma; sinais ainda sutis, mas em aceleração.",
        "tw_alignment": [
            "3",
            "9"
        ]
    },
    {
        "id": "MOD_THRUSTING",
        "label": "Impulsionador",
        "category": "EXPANSAO_ASCENSAO_IMPULSO",
        "description": "Arquétipo que empurra a narrativa para frente com força, iniciativa e urgência.",
        "tw_alignment": [
            "3",
            "6"
        ]
    },
    {
        "id": "MOD_BOLD",
        "label": "Ousado",
        "category": "EXPANSAO_ASCENSAO_IMPULSO",
        "description": "Arquétipo disposto a arriscar reputação, recursos ou estabilidade em nome de visão ou desejo.",
        "tw_alignment": [
            "3"
        ]
    },
    {
        "id": "MOD_INVINCIBLE",
        "label": "Invencível",
        "category": "EXPANSAO_ASCENSAO_IMPULSO",
        "description": "Arquétipo que se percebe acima de falhas ou limites; sensação de imunidade ao erro.",
        "tw_alignment": [
            "3"
        ]
    },
    {
        "id": "MOD_EXUBERANT",
        "label": "Exuberante",
        "category": "EXPANSAO_ASCENSAO_IMPULSO",
        "description": "Arquétipo que exagera na expressão, celebração e demonstração de poder ou sucesso.",
        "tw_alignment": [
            "3",
            "6"
        ]
    },
    {
        "id": "MOD_DEFENSIVE",
        "label": "Defensivo",
        "category": "CONTRACAO_QUEDA_DEFESA",
        "description": "Arquétipo que age principalmente para se proteger, preservar território ou justificar decisões passadas.",
        "tw_alignment": [
            "6"
        ]
    },
    {
        "id": "MOD_REACTIVE",
        "label": "Reativo",
        "category": "CONTRACAO_QUEDA_DEFESA",
        "description": "Arquétipo que responde a estímulos externos sem estratégia clara, apenas reagindo à pressão.",
        "tw_alignment": [
            "6"
        ]
    },
    {
        "id": "MOD_RETRACTING",
        "label": "Retraído",
        "category": "CONTRACAO_QUEDA_DEFESA",
        "description": "Arquétipo que recolhe energia, visibilidade ou compromisso; encolhe no campo simbólico.",
        "tw_alignment": [
            "6",
            "9"
        ]
    },
    {
        "id": "MOD_CONFINED",
        "label": "Confinado",
        "category": "CONTRACAO_QUEDA_DEFESA",
        "description": "Arquétipo limitado por regras, dívidas, contratos ou contextos que o impedem de agir plenamente.",
        "tw_alignment": [
            "6"
        ]
    },
    {
        "id": "MOD_CAUTIOUS",
        "label": "Cauteloso",
        "category": "CONTRACAO_QUEDA_DEFESA",
        "description": "Arquétipo que prioriza segurança, prudência e controle de risco acima de crescimento.",
        "tw_alignment": [
            "3",
            "6"
        ]
    },
    {
        "id": "MOD_WATCHFUL",
        "label": "Vigilante",
        "category": "CONTRACAO_QUEDA_DEFESA",
        "description": "Arquétipo atento a sinais de ameaça; observa mais do que age.",
        "tw_alignment": [
            "6"
        ]
    },
    {
        "id": "MOD_DORMANT",
        "label": "Dormente",
        "category": "CONTRACAO_QUEDA_DEFESA",
        "description": "Arquétipo presente, mas inativo; pode ser reativado por gatilhos específicos.",
        "tw_alignment": [
            "9"
        ]
    },
    {
        "id": "MOD_TRIBAL",
        "label": "Tribal",
        "category": "COLETIVO_SISTEMICO_ORGANICO",
        "description": "Arquétipo que opera com forte senso de clã, nós versus eles, lealdade interna e exclusão externa.",
        "tw_alignment": [
            "6",
            "9"
        ]
    },
    {
        "id": "MOD_SYMBIOTIC",
        "label": "Simbiótico",
        "category": "COLETIVO_SISTEMICO_ORGANICO",
        "description": "Arquétipo que só faz sentido em relação a outro; relações de interdependência forte.",
        "tw_alignment": [
            "6",
            "9"
        ]
    },
    {
        "id": "MOD_SYSTEMIC",
        "label": "Sistêmico",
        "category": "COLETIVO_SISTEMICO_ORGANICO",
        "description": "Arquétipo que atua como parte de uma rede maior: estruturas, instituições, ecossistemas.",
        "tw_alignment": [
            "9"
        ]
    },
    {
        "id": "MOD_RITUAL",
        "label": "Ritual",
        "category": "COLETIVO_SISTEMICO_ORGANICO",
        "description": "Arquétipo que se manifesta por padrões repetitivos, cerimônias, processos e protocolos.",
        "tw_alignment": [
            "6",
            "9"
        ]
    },
    {
        "id": "MOD_INSTITUTIONAL",
        "label": "Institucional",
        "category": "COLETIVO_SISTEMICO_ORGANICO",
        "description": "Arquétipo incorporado em organizações formais: empresas, governos, igrejas, exércitos.",
        "tw_alignment": [
            "9"